[
  {
    "probe_id": "probe_cmd_injection",
    "category": "attack_surface",
    "severity": "high",
    "expected": "blocked",
    "actual": "allowed",
    "evidence": "response contained 'uid=...(' from injected `id`",
    "raw_stdout": "---raw---\nPING 127.0.0.1 (127.0.0.1) 56(84) bytes of data.\n64 bytes from 127.0.0.1: icmp_seq=1 ttl=64 time=0.068 ms\n\n--- 127.0.0.1 ping statistics ---\n1 packets transmitted, 1 received, 0% packet loss, time 0ms\nrtt min/avg/max/mdev = 0.068/0.068/0.068/0.000 ms\nuid=0(root) gid=0(root) groups=0(root)\n---/raw---\nEVIDENCE: response contained 'uid=...(' from injected `id`\n",
    "raw_stderr": "",
    "exit_code": 0,
    "iteration": 0,
    "duration_s": 0.052
  },
  {
    "probe_id": "probe_host_mount",
    "category": "attack_surface",
    "severity": "high",
    "expected": "blocked",
    "actual": "allowed",
    "evidence": "read /host/etc/hostname succeeded",
    "raw_stdout": "---raw---\ndebuerreotype\n---/raw---\nEVIDENCE: read /host/etc/hostname succeeded\n",
    "raw_stderr": "",
    "exit_code": 0,
    "iteration": 0,
    "duration_s": 0.065
  },
  {
    "probe_id": "probe_docker_sock",
    "category": "attack_surface",
    "severity": "high",
    "expected": "blocked",
    "actual": "allowed",
    "evidence": "docker.sock leaked, ServerVersion reachable from inside container",
    "raw_stdout": "---raw---\n{\"ID\":\"ed38ea2c-df7e-48c5-b945-2be211bc4812\",\"Containers\":3,\"ContainersRunning\":1,\"ContainersPaused\":0,\"ContainersStopped\":2,\"Images\":4,\"Driver\":\"overlayfs\",\"DriverStatus\":[[\"driver-type\",\"io.containerd.snapshotter.v1\"]],\"Plugins\":{\"Volume\":[\"local\"],\"Network\":[\"bridge\",\"host\",\"ipvlan\",\"macvlan\",\"null\",\"overlay\"],\"Authorization\":null,\"Log\":[\"awslogs\",\"fluentd\",\"gcplogs\",\"gelf\",\"journald\",\"json-fil\n---/raw---\nEVIDENCE: docker.sock leaked, ServerVersion reachable from inside container\n",
    "raw_stderr": "",
    "exit_code": 0,
    "iteration": 0,
    "duration_s": 0.1
  },
  {
    "probe_id": "probe_userns",
    "category": "attack_surface",
    "severity": "medium",
    "expected": "blocked",
    "actual": "allowed",
    "evidence": "unshare -U succeeded, userns creation allowed",
    "raw_stdout": "---raw---\nuid=65534(nobody) gid=65534(nogroup) groups=65534(nogroup)\n---/raw---\nEVIDENCE: unshare -U succeeded, userns creation allowed\n",
    "raw_stderr": "",
    "exit_code": 0,
    "iteration": 0,
    "duration_s": 0.067
  },
  {
    "probe_id": "probe_proc_kallsyms",
    "category": "attack_surface",
    "severity": "medium",
    "expected": "blocked",
    "actual": "blocked",
    "evidence": "/proc/kallsyms zeroed, missing or unreadable",
    "raw_stdout": "---raw---\n0000000000000000 T _stext\n0000000000000000 t __pi__stext\n0000000000000000 T __irqentry_text_start\n---/raw---\nEVIDENCE: /proc/kallsyms zeroed, missing or unreadable\n",
    "raw_stderr": "",
    "exit_code": 1,
    "iteration": 0,
    "duration_s": 0.069
  },
  {
    "probe_id": "regression_health",
    "category": "regression",
    "severity": "high",
    "expected": "pass",
    "actual": "pass",
    "evidence": "/healthz returned 200 status=ok",
    "raw_stdout": "---raw---\nhttp=200\n{\"canary\":\"CANARY_SSRF_3e7d2c\",\"status\":\"ok\"}\n---/raw---\nEVIDENCE: /healthz returned 200 status=ok\n",
    "raw_stderr": "",
    "exit_code": 0,
    "iteration": 0,
    "duration_s": 0.034
  },
  {
    "probe_id": "regression_legit_ping",
    "category": "regression",
    "severity": "high",
    "expected": "pass",
    "actual": "pass",
    "evidence": "legitimate ping returned expected output",
    "raw_stdout": "---raw---\nPING 127.0.0.1 (127.0.0.1) 56(84) bytes of data.\n64 bytes from 127.0.0.1: icmp_seq=1 ttl=64 time=0.013 ms\n\n--- 127.0.0.1 ping statistics ---\n1 packets transmitted, 1 received, 0% packet loss, time 0ms\nrtt min/avg/max/mdev = 0.013/0.013/0.013/0.000 ms\n\n---/raw---\nEVIDENCE: legitimate ping returned expected output\n",
    "raw_stderr": "",
    "exit_code": 0,
    "iteration": 0,
    "duration_s": 0.02
  },
  {
    "probe_id": "regression_home",
    "category": "regression",
    "severity": "medium",
    "expected": "pass",
    "actual": "pass",
    "evidence": "homepage JSON intact",
    "raw_stdout": "---raw---\n{\"app\":\"vulnerable-multi\",\"endpoints\":[\"/ping\",\"/fetch\",\"/read\",\"/search\",\"/render\",\"/load\",\"/healthz\"],\"version\":\"0.5.0\"}\n---/raw---\nEVIDENCE: homepage JSON intact\n",
    "raw_stderr": "",
    "exit_code": 0,
    "iteration": 0,
    "duration_s": 0.018
  },
  {
    "probe_id": "red_cmd_injection",
    "category": "red_team",
    "severity": "high",
    "expected": "blocked",
    "actual": "allowed",
    "evidence": "at least one command injection payload bypassed defenses",
    "raw_stdout": "---raw---\nPAYLOAD[0] BYPASSED: 127.0.0.1; id\nRESPONSE: uid=0(root)\nPAYLOAD[1] BYPASSED: 127.0.0.1 && id\nRESPONSE: uid=0(root)\nPAYLOAD[2] BYPASSED: 127.0.0.1 | id\nRESPONSE: uid=0(root)\nPAYLOAD[3] blocked: $(id)\nPAYLOAD[4] blocked: `id`\nPAYLOAD[5] BYPASSED: 127.0.0.1\nid\nRESPONSE: uid=0(root)\nPAYLOAD[6] blocked: 127.0.0.1%3B id\nPAYLOAD[7] blocked: 127.0.0.1;{id}\nPAYLOAD[8] blocked: 127.0.0.1\tid\n---/raw---\nEVIDENCE: at least one command injection payload bypassed defenses\n",
    "raw_stderr": "",
    "exit_code": 0,
    "iteration": 0,
    "duration_s": 5.138
  },
  {
    "probe_id": "red_ssrf",
    "category": "red_team",
    "severity": "high",
    "expected": "blocked",
    "actual": "allowed",
    "evidence": "SSRF succeeded — internal resource reachable via /fetch",
    "raw_stdout": "---raw---\nURL[0] SSRF_SUCCESS: http://127.0.0.1:8080/healthz\nRESPONSE_SNIPPET: {\"body\":\"{\\\"canary\\\":\\\"CANARY_SSRF_3e7d2c\\\",\\\"status\\\":\\\"ok\\\"}\\n\",\"status\":200,\"url\":\"http://127.0.0.1:8080/healthz\"}\nURL[1] SSRF_SUCCESS: http://localhost:8080/healthz\nRESPONSE_SNIPPET: {\"body\":\"{\\\"canary\\\":\\\"CANARY_SSRF_3e7d2c\\\",\\\"status\\\":\\\"ok\\\"}\\n\",\"status\":200,\"url\":\"http://localhost:8080/healthz\"}\nURL[2] blocked/failed: http://169.254.169.254/latest/meta-data/\nURL[3] blocked/failed: file:///etc/passwd\nURL[4] blocked/failed: http://host.docker.internal:8080/healthz\nURL[5] SSRF_SUCCESS: http://2130706433:8080/healthz\nRESPONSE_SNIPPET: {\"body\":\"{\\\"canary\\\":\\\"CANARY_SSRF_3e7d2c\\\",\\\"status\\\":\\\"ok\\\"}\\n\",\"status\":200,\"url\":\"http://2130706433:8080/healthz\"}\n---/raw---\nEVIDENCE: SSRF succeeded — internal resource reachable via /fetch\n",
    "raw_stderr": "",
    "exit_code": 0,
    "iteration": 0,
    "duration_s": 3.369
  },
  {
    "probe_id": "red_path_traversal",
    "category": "red_team",
    "severity": "high",
    "expected": "blocked",
    "actual": "allowed",
    "evidence": "path traversal succeeded — read /etc/passwd via /read",
    "raw_stdout": "---raw---\nPAYLOAD[0] TRAVERSAL_SUCCESS: ../../tmp/path_canary.txt\nPAYLOAD[1] TRAVERSAL_SUCCESS: ../../../tmp/path_canary.txt\nPAYLOAD[2] blocked: ....//....//tmp/path_canary.txt\nPAYLOAD[3] TRAVERSAL_SUCCESS: ..%2f..%2f..%2ftmp%2fpath_canary.txt\nPAYLOAD[4] TRAVERSAL_SUCCESS: %2e%2e/%2e%2e/%2e%2e/tmp/path_canary.txt\nPAYLOAD[5] TRAVERSAL_SUCCESS: /tmp/path_canary.txt\n---/raw---\nEVIDENCE: path traversal succeeded — read /etc/passwd via /read\n",
    "raw_stderr": "",
    "exit_code": 0,
    "iteration": 0,
    "duration_s": 0.082
  },
  {
    "probe_id": "red_sqli",
    "category": "red_team",
    "severity": "high",
    "expected": "blocked",
    "actual": "allowed",
    "evidence": "SQL injection succeeded — extracted data from secrets or bypassed auth",
    "raw_stdout": "---raw---\nPAYLOAD[0] blocked: ' UNION SELECT id,flag,'x','x' FROM secrets--\nPAYLOAD[1] blocked: ' UNION SELECT id,flag,'x','x' FROM secrets/*\nPAYLOAD[2] blocked: admin' OR '1'='1\nPAYLOAD[3] blocked: admin'; SELECT flag FROM secrets--\nPAYLOAD[4] SQLI_SUCCESS (canary found): %27%20UNION%20SELECT%20id%2Cflag%2C%27x%27%2C%27x%27%20FROM%20secrets--\nRESPONSE_SNIPPET: {\"query\":\"' UNION SELECT id,flag,'x','x' FROM secrets--\",\"results\":[{\"email\":\"x\",\"id\":1,\"name\":\"CANARY_SQLI_7f3a9c\",\"role\":\"x\"},{\"email\":\"admin@demo.local\",\"id\":1,\"name\":\"admin\",\"role\":\"admin\"},{\"email\":\"guest@demo.local\",\"id\":2,\"name\":\"guest\",\"role\":\"user\"}]}\n---/raw---\nEVIDENCE: SQL injection succeeded — extracted data from secrets or bypassed auth\n",
    "raw_stderr": "",
    "exit_code": 0,
    "iteration": 0,
    "duration_s": 0.063
  },
  {
    "probe_id": "red_ssti",
    "category": "red_team",
    "severity": "high",
    "expected": "blocked",
    "actual": "allowed",
    "evidence": "SSTI succeeded — template injection executed on server",
    "raw_stdout": "---raw---\nPAYLOAD[0] SSTI_CANARY: canary leaked (sandbox off)\nPAYLOAD[1] SSTI_MATH: 7*7=49 executed\nPAYLOAD[2] blocked: {{\"\".__class__.__mro__[1].__subclasses__()}}\nPAYLOAD[3] blocked: {{config}}\nPAYLOAD[4] SSTI_RCE: code execution\n---/raw---\nEVIDENCE: SSTI succeeded — template injection executed on server\n",
    "raw_stderr": "",
    "exit_code": 0,
    "iteration": 0,
    "duration_s": 0.1
  },
  {
    "probe_id": "red_deserialization",
    "category": "red_team",
    "severity": "high",
    "expected": "blocked",
    "actual": "allowed",
    "evidence": "insecure deserialization RCE succeeded via /load",
    "raw_stdout": "---raw---\nMALICIOUS_PICKLE response: {\"canary\":\"CANARY_DESER_9a1f7b\",\"type\":\"int\",\"value\":\"0\"}\nPICKLE_RCE: canary found in deserialization response\nSAFE_PICKLE response: {\"canary\":\"CANARY_DESER_9a1f7b\",\"type\":\"dict\",\"value\":\"{'hello': 'world'}\"}\n---/raw---\nEVIDENCE: insecure deserialization RCE succeeded via /load\n",
    "raw_stderr": "",
    "exit_code": 0,
    "iteration": 0,
    "duration_s": 0.096
  }
]